{
  "$schema": "https://json-schema.org/draft/2020-12/schema",
  "$id": "https://spec.consiliency/spec-parity/certificate.schema.json",
  "title": "Parity certificate",
  "description": "What a parity certificate MUST pin. This is the UNION of the internal storage `certificates` record shape and the richer design task (canon/idmodel versions, projection-algo version, per-dim results). The certificate is a DIGEST-BEARING record: its top-level `digest` field is computed with the canon `certificate` profile (`spec-canon:v2:certificate\\n`) and is EXCLUDED from its own preimage (canon sec 8). PRODUCE ONCE, STORE VERBATIM, never recompute (canon sec 9). NO JSON FLOATS. This schema is co-designed with the consumer-integration phase; fields here that consumers also need (digest byte-match domain, parity-gate vs policy-gate) are flagged OPEN, see SEMANTICS.md sec 9.",
  "type": "object",
  "additionalProperties": false,
  "required": [
    "schema_version",
    "projection_algo_version",
    "canon_version",
    "idmodel_version",
    "kind_alignment_version",
    "permitted_freedom_vocab_version",
    "ec_revision_id",
    "spec_revision_digest",
    "desired_graph_digest",
    "ec_digest",
    "ec_reproducible",
    "spec_authority",
    "code_head_sha",
    "overall_result_state",
    "dimension_results",
    "findings_ref",
    "digest"
  ],
  "allOf": [{
    "if": { "properties": { "projection_algo_version": { "const": "spec-engine-projection:v5" } } },
    "then": { "properties": { "dimension_results": { "minItems": 6, "maxItems": 6 } } },
    "else": { "properties": { "dimension_results": { "minItems": 5, "maxItems": 5 } } }
  }],
  "properties": {
    "schema_version": { "const": "2", "description": "This certificate schema version (the certificate-contract version). \"2\": hashed `spec_authority` (required) and optional `authority_ref`; `desired_graph_digest` is the normalized spec-graph digest; `ec_reproducible` is required. A \"1\" certificate stays a valid v1 record and is never re-hashed as v2." },
    "projection_algo_version": {
      "type": "string",
      "enum": ["spec-engine-projection:v1", "spec-engine-projection:v2", "spec-engine-projection:v3", "spec-engine-projection:v4", "spec-engine-projection:v5"],
      "description": "Version of the P/N projection+parity ALGORITHM that produced this result. Pinning this makes a certificate reproducible: two certificates over the same inputs but different algo versions are legitimately allowed to differ. Currently `spec-engine-projection:v5` (certificate schema_version \"2\"); the history is SEMANTICS.md sec 9.2. Only the known versions v1-v5 are valid; an unknown version is refused by name, never read under another version's rules. (Task item 8.)"
    },
    "canon_version": { "type": "string", "description": "canon contract version used (`v2` since NFCBOUNDARY: NFC at the ingest boundary, digest prefix `spec-canon:v2:`). v1 certificates stay valid as v1 records; a v1 digest is never compared to a v2 digest and a mixed-canon_version graph is rejected." },
    "idmodel_version": { "type": "string", "description": "idmodel contract version used (e.g. `v1`)." },
    "kind_alignment_version": { "type": "string", "description": "Version of kind-alignment.json used. (The matrix is part of the parity semantics; a matrix change can change results, so it is pinned.)" },
    "permitted_freedom_vocab_version": { "type": "string", "description": "Version of spec-parity/permitted-freedom-vocab.json used. The vocabulary defines which permitted_freedom tokens (and thus which below-frontier deviations) the soundness matcher excuses; a vocab change can change the result, so it is pinned (SEMANTICS.md sec 3 / sec 9)." },
    "ec_revision_id": {
      "type": "string",
      "description": "The REALIZED-side revision_id this certificate is about (the storage `revisions.revision_id` for E(C)). Distinct from the spec/desired revision, which is pinned by spec_revision_digest. revision_alignment (sec 7.5) relates this E(C) revision to the spec revision."
    },
    "spec_revision_digest": {
      "type": "string",
      "description": "Digest pinning the exact spec/desired-graph REVISION: the canon semantic-content digest of {\"spec_revision_id\": S.spec_revision_id (\"\" when absent), \"desired_graph_digest\": desired_graph_digest} (SEMANTICS.md sec 9). Distinct from desired_graph_digest: this binds the graded but unhashed spec_revision_id, that pins the graph content. A verifier binds S by the PAIR."
    },
    "desired_graph_digest": {
      "type": "string",
      "description": "The NORMALIZED desired-graph digest of the S that was checked: spec_graph.graph_digest(S), i.e. canon semantic-content over S's hashed content only (spec-graph SPEC sec 2; nodes and edges sorted by Normalize). Envelope fields (rationale, notes, source_position, provenance, unratified, graph_id) and authoring order do NOT move it. The engine grades exactly this preimage (the graded view, SEMANTICS sec 9), so two S with one desired_graph_digest AND one spec_revision_digest grade identically against the same E(C), run descriptor, correspondence and waivers. A draft and its ratified S share this digest; `spec_authority` tells them apart, so a verifier binding an S' must structurally validate S', recompute this digest AND spec_revision_digest from S', and check that is_authoritative(S') matches `spec_authority` (SEMANTICS sec 9 binding procedure). (Schema version 1 certificates carried the raw-S canon digest here.)"
    },
    "ec_digest": {
      "type": "string",
      "description": "canon semantic-content digest of E(C) -- the realized Interface Boundary IR extract that was checked. For fixture runs this is the fixture's digest. PARITY OVER A NON-REPRODUCIBLE E(C) IS MEANINGLESS (Benchmark C): a certificate over an E(C) that is not byte-reproducible is advisory only and MUST set ec_reproducible=false."
    },
    "ec_reproducible": {
      "type": "boolean",
      "description": "MEASURED OR FALSE: true iff the producing run MEASURED E(C) to be byte-reproducible (Benchmark C: E(C) extracted twice by independent extractor invocations, canonical bytes identical). A frozen/pinned/fixture E(C) that the run did not re-extract is NOT measured and is false. When false the certificate is ADVISORY and downstream gates MUST NOT treat it as authoritative. Never changes a finding or result_state."
    },
    "spec_authority": {
      "type": "string",
      "enum": ["grounded", "draft"],
      "description": "HASHED. Whether the checked S is an authority (SEMANTICS sec 9): `grounded` iff the anti-vacuity predicate is_authoritative(S) holds (at least one contract/architecture node whose effective provenance origin is human_authored and that is not marked unratified), else `draft` (a code-, doc- or LLM-derived or never-ratified S). It is derived from S's provenance envelope, which desired_graph_digest excludes, so it is pinned here. Delivery refuses a `draft` certificate unless the consumer opts in (SEMANTICS sec 12.6). Never changes a finding or result_state."
    },
    "authority_ref": {
      "type": "string",
      "pattern": "^[0-9a-f]{64}$",
      "not": {"pattern": "\\n"},
      "description": "OPTIONAL, HASHED. The authority-ledger `entry_digest` of the ratify event the producer cites as making S authoritative, recorded verbatim when the caller supplies one (only for a `grounded` S). The engine does NOT verify it; a verifier resolves it against the authority ledger. It cannot be a ratify of THIS certificate (that event signs this certificate's digest). Absent when none was supplied."
    },
    "code_head_sha": {
      "type": "string",
      "description": "The code repo HEAD sha the E(C) was extracted from (provenance pin)."
    },
    "overall_result_state": {
      "$ref": "result-state.schema.json#/$defs/result_state",
      "description": "Aggregated state per SEMANTICS.md sec 6.4. Anything other than `pass` (and `not_applicable` which is neutral) makes the certificate NON-GREEN. INVARIANT: byte-equal to the referenced finding_set.overall_result_state (the certificate copy is derived from, never recomputed against, the finding_set at findings_ref)."
    },
    "dimension_results": {
      "type": "array",
      "items": { "$ref": "result-state.schema.json#/$defs/dimension_result" },
      "minItems": 5,
      "maxItems": 6,
      "description": "Per-dimension results embedded for at-a-glance gating; the full findings live behind findings_ref. INVARIANT: byte-equal (after canon canonicalization) to the referenced finding_set.dimension_results."
    },
    "findings_ref": {
      "type": "string",
      "description": "Digest ref to the finding_set artifact (result-state.schema.json finding_set). Pointer, not payload (portal metadata_only)."
    },
    "waivers_ref": {
      "type": "string",
      "description": "Optional digest ref to the set of waivers in effect for this run: canon semantic-content digest of {as_of, waivers} (the run descriptor's deterministic evaluation date + the supplied waiver list; an expired waiver -- expiry < as_of -- suppresses nothing). Waived findings remain non-pass in dimension_results; this ref records WHY they are not gating. Absent if no waivers."
    },
    "digest": {
      "type": "string",
      "description": "The AUTHORITATIVE identity of the certificate: the certificate-profile content digest = lowercase hex SHA-256 over `spec-canon:v2:certificate\\n` || canonical_bytes(certificate-without-this-top-level-`digest`-field). EXCLUDED from its own preimage (canon sec 8). There is deliberately NO separate hashed `certificate_id` field (that would be circular: it would sit inside the preimage). A `certificate_id` mirror, if a storage index needs one, lives in the non-hashed `locator` (below) and equals this `digest`."
    },
    "vacuity": {
      "type": "object",
      "description": "OPTIONAL, HASHED (inside the certificate digest preimage). Present (is_vacuous=true) ONLY when the certify VACUITY TRIPWIRE fired: E(C) had NO kind-aligned realized boundary (no real code to certify), so overall_result_state is not_applicable across every dimension. This is what lets a consumer tell a vacuous refusal from an ordinary single-revision not_applicable WITHOUT trusting the unhashed finding_set — it is NOT a fake-green. Absent on every non-vacuous certificate (so existing certificates are byte-identical and their digests unchanged). Mirrors finding_set.vacuity.",
      "additionalProperties": false,
      "required": ["is_vacuous", "reason", "realized_boundary_count", "kind_aligned_realized_count"],
      "properties": {
        "is_vacuous": { "const": true },
        "reason": { "type": "string" },
        "realized_boundary_count": { "type": "integer", "minimum": 0 },
        "kind_aligned_realized_count": { "type": "integer", "minimum": 0, "const": 0 },
        "extraction_coverage": { "$ref": "result-state.schema.json#/$defs/extraction_coverage_summary" }
      }
    },
    "extraction_coverage": {
      "$ref": "result-state.schema.json#/$defs/extraction_coverage_summary",
      "description": "OPTIONAL, HASHED (inside the certificate digest preimage). Present ONLY when E(C)'s extraction was NOT fully observed — `partial` (the realized adapter measured unextracted source: unparseable files, unlisted on-disk source files, syntax-error trees, uncompiled .proto) or `unmeasured`. A certificate carrying it can never be read as full coverage: under it no prohibition passes, a completeness absence is unknown and closure is unknown (SEMANTICS sec 4.2 / 7.1 / 7.3). Absent when the extraction was measured full or the E(C) declares no extraction_coverage (hand-authored fixture). Mirrors finding_set.extraction_coverage."
    },
    "locator": {
      "type": "object",
      "description": "NON-HASHED envelope (canon sec 10): wall-clock created time, producer host/version display, run_id, and an optional `certificate_id` mirror of `digest`. Changing these MUST NOT change `digest`. The hashed `run` digest (if a run is associated) lives in the runs record, not here.",
      "additionalProperties": true,
      "properties": {
        "certificate_id": { "type": "string", "description": "Optional storage-index mirror of the top-level `digest`. Non-hashed; equals `digest`. Avoids the circularity of a hashed id field." },
        "created_at": { "type": "string" },
        "producer": { "type": "string" },
        "run_id": { "type": "string" }
      }
    }
  }
}
